,Target,Tweet,Stance
2080,Hillary Clinton, overheard at the davenport open house oh i know you from facebook digital organizing ,0
2081,Hillary Clinton, is not qualified b c he eats in snacks b c of d corruption of bridgegate a big fat bully ,0
2082,Hillary Clinton, sarah babb inaugural tweet from our new account go ,0
2083,Hillary Clinton, like i tweeted you way back when aca software can be fixed but gop strategic mistake of repeal can t be fixed ,0
2084,Hillary Clinton, we love joe and bernie but they are too old they would end up a one term president ,0
2085,Hillary Clinton, her name is rio and she dances in the sanaaaaand whoooo ot ,0
2086,Hillary Clinton, hillary campaign will shortly announce that sanders was born in canada yeah that s it ,0
2087,Hillary Clinton, bill clinton decided against taking out bin laden and we got september ,0
2088,Hillary Clinton, yawnzzzzzzzzzzzzzz could keep the z s going for the full amt of tweet characters but you get the point ,0
2089,Hillary Clinton, the democrats are not creating al qaeda they are creating a nuclear isis think about that ,0
2090,Hillary Clinton, kind of scares me that there are still thousands of emails that have not been released from hillary s private emails ,0
2091,Hillary Clinton, the donald can t keep a beauty pageant afloat and wants to be the president aw hell no ,0
2092,Hillary Clinton, you know emailgate must be going nowhere when fox news are hashing out the bosnia sniper fire story again ,0
2093,Hillary Clinton, big booty bitches big big booty bitches ,0
2094,Hillary Clinton, i love bern but it s not his time ,0
2095,Hillary Clinton, it s what s best for business and presidential seat for hillary clinton ,0
2096,Hillary Clinton, it s great that supports gmo crops it s like the it scepticism all over again science vs belief jeb bush ,0
2097,Hillary Clinton, folks this is what happens when liberals are in control all hell breaks loose had enough yet ,0
2098,Hillary Clinton, if you need me i ll be screaming like a little baby from now until about ten minutes after arrives in p town ,0
2099,Hillary Clinton, the biggest dumps of bad info is before a holiday weekend what comes out of wh and state dept today hillary emails liar liar ,0
2100,Hillary Clinton, leader of free world global navigating interacting with the international community beyond big crowds learned lesson ,0
2101,Hillary Clinton, those aren t pantsuits they are camouflage outfits carefully tailored to minimize silhouette think stealthsuits very high tech ,0
2102,Hillary Clinton, just ordered my chillary clinton koozies gotta support the team ,0
2103,Hillary Clinton, we can t expect change if we continue to vote for the same people you have to take a chance yrs is not that long bernie ,0
2104,Hillary Clinton, not good when only defends you your big mouth giant ego are your downfall ,0
2105,Hillary Clinton, hillary must have been at the navy yard under sniper fire ,0
2106,Hillary Clinton, i choose it takes a village ,0
2107,Hillary Clinton, at least he didn t lose an embassy cover up a murder or burn govt emails ,0
2108,Hillary Clinton, hillary has been lying for so long that her first fib was in morse code hill no ,0
2109,Hillary Clinton, everyday americans and their families need a champion and hillary will be that champion ,1
2110,Hillary Clinton, i need meninist because is running for president do i need to say more ,0
2111,Hillary Clinton, cruz perry it s the only win win choice ,0
2112,Hillary Clinton, cpc thinks they can run antisocial personal attack advertising on laughing out loud stop harper feel the bern ,2
2113,Hillary Clinton, bernie sanders had record crowds in madison wis why no mention from you guys you talked about trump trump ,2
2114,Hillary Clinton, was asked by to help with her campaign gladly excitedly accepted ,1
2115,Hillary Clinton, come on iowa for better usa and the row ,1
2116,Hillary Clinton, pundits say jim webb facing uphill battle with hillary really it s with bernie for the anti hillary vote jim webb ,0
2117,Hillary Clinton, exciting to hear more about our fellows all across the country on tonight s call special shout out to the fellows ia ,2
2118,Hillary Clinton, hillary s doing the right thing staying focus on her campaign ,1
2119,Hillary Clinton, do democrats other realize no one wants hillary clinton which is obamanation ,0
2120,Hillary Clinton, thanks for the follow david may god bless you and your family ,2
2121,Hillary Clinton, citizen can t even manage and she wants to be laughing out loud ,0
2122,Hillary Clinton, can t even manage and she wants to be laughing out loud stop hillary ,0
2123,Hillary Clinton, can t even manage and she wants to be laughing out loud ,0
2124,Hillary Clinton, can t even manage and she wants to be laughing out loud ,0
2125,Hillary Clinton, can t even manage and she wants to be laughing out loud wake up america stop hillary ,0
2126,Hillary Clinton, why is this woman like teflon she has committed enuf egregious crimes she should b superglued the dang wall ,0
2127,Hillary Clinton, can t even manage and she wants to be laughing out loud wake up america stop hillary ,0
2128,Hillary Clinton, can t even manage and she wants to be laughing out loud wake up america stop hillary ,0
2129,Hillary Clinton, can t even manage and she wants to be laughing out loud wake up america stop hillary ,0
2130,Hillary Clinton, they know they re going to lose to hrc so they keep trying ,1
2131,Hillary Clinton, can t even manage and she wants to be laughing out loud wake up america stop hillary ,0
2132,Hillary Clinton, if you support you are supporting another term of the policies of george w bush ,0
2133,Hillary Clinton, buffy welcome little sister love you ,2
2134,Hillary Clinton, can t even manage she wants to be wake up america stop hillary ,0
2135,Hillary Clinton, can t even manage and she wants to be laughing out loud wake up america stop hillary ,0
2136,Hillary Clinton, can t even manage and she wants to be laughing out loud wake up america stop hillary ,0
2137,Hillary Clinton, can t even manage and she wants to be laughing out loud wake up america stop hillary ,0
2138,Hillary Clinton, another hillary supporter committed to caucus tonight one more step on the way to winning the iowa caucus ,1
2139,Hillary Clinton, can t even manage and she wants to be laughing out loud wake up america stop hillary ,0
2140,Hillary Clinton, so thankful for all of the volunteers who joined us at bliss studio in fairfield tonight rockstars ,2
2141,Hillary Clinton, the most revealing part about hillary s released emails is that they re pretty much as boring as mine ,0
2142,Hillary Clinton, if you re the best your side has to offer we have nothing to worry about slick ,2
2143,Hillary Clinton, without the blacks and minority voters no won t happen ,2
2144,Hillary Clinton, he is what he is and it doesn t resonate with minority and black voters ,2
2145,Hillary Clinton, this is why i m not voting for hillary ,0
2146,Hillary Clinton, not even a little bit nobama we miss you gipper ,2
2147,Hillary Clinton, putin nothing more american than voting based for a politician to lead the country when she can t even handle email ,0
2148,Hillary Clinton, putin nothing more american than voting for a politician to lead the country when she can t even handle email ,0
2149,Hillary Clinton, people that are surprising trump fiorina why cause they re being honest w what they think obama built that ,2
2150,Hillary Clinton, so we re to believe that santa is a hairstylist um okay you often need code for that lies ,2
2151,Hillary Clinton, jimmy fallon music playing thank you donald trump for driving latinos and gays out to vote by the millions love ,2
2152,Hillary Clinton, who gives a rate ass what a old queen has to say about clarence thomas ,2
2153,Hillary Clinton, so excited to hear speak here at in hanover hillaryin nh ,1
2154,Hillary Clinton, hillary in nh is like adolph hitler in a synagogue ,0
2155,Hillary Clinton, welcome twitter proud to be uniteblue war on women tn all lives matter ,2
2156,Hillary Clinton, volunteer with your local campaign this weekend help build team hillary march w us in bethesda md ,1
2157,Hillary Clinton, didn t think about that don t think i d ever vote for someone with dual citizenship can t believe it s legal bernie ,2
2158,Hillary Clinton, clinton entitlement is the proverbial american hemorrhoid opinionated ,0
2159,Hillary Clinton, norman hsu illegally donated to there is evidence he worked for china white house for sale ,0
2160,Hillary Clinton, i would have to agree but i would be surprised if he gets the nom jeb bush has the money and he s a moderate ,2
2161,Hillary Clinton, lied about the cost of the gala she was fined for it but if it were they d be in jail unfit for office ,0
2162,Hillary Clinton, fabulous you hit on every subject and i am proud of you ending on a note of kindness hillary in nh ,1
2163,Hillary Clinton, socialmedia is not for if you insult people you don t know you are the above resign ,2
2164,Hillary Clinton, how could anyone vote for that woman ,0
2165,Hillary Clinton, hillary s nose from lying is now bigger than bill s cigars ,0
2166,Hillary Clinton, bur hlllary just raised million ,0
2167,Hillary Clinton, hopefully hillary clinton gets cancer and dies before she gets the opportunity to embarrass our country any further ,0
2168,Hillary Clinton, i hear the peter gunn theme she s going to kick some serious gop ass ,0
2169,Hillary Clinton, at least the few mistakes made by candidates on the campaign aren t felonies like the ones makes ohhillno ,0
2170,Hillary Clinton, great comments by about pathological liar hillary clinton ,0
2171,Hillary Clinton, i wish bernie s fans would stop screaming bernie ,0
2172,Hillary Clinton, is the only honest voice of the and that should scare the shit out of everyone ,0
2173,Hillary Clinton, so tht will never erase their support of doma silence on lgbt lgbtq rights until it is politically aventageous ,0
2174,Hillary Clinton, fortunately bryan he does not have a saying on that ,0
2175,Hillary Clinton, super out of touch and stupid please go away nyc pride nyc ,0
2176,Hillary Clinton, why not they lie about everything else even when confronted with the truth ,0
2177,Hillary Clinton, over the river and through the woods and up with hill we go yass hillary clinton hillary ,0
2178,Hillary Clinton, i am a big hillary clinton supporter my plan is working poor donnie doesn t even know trump ,0
2179,Hillary Clinton, what bernie has done is work for decades on behalf of the american people not the corporatocracy who own corrupted ,0
2180,Hillary Clinton, common core another brilliant idea supported by a ,0
2181,Hillary Clinton, do we breathe live or ignore collectively succumb to toxins of political ecological unwanton oligards ,0
2182,Hillary Clinton, she s not a woman she s a politician why im not voting for hillary stop hillary clinton benghazi usa ,0
2183,Hillary Clinton, i wish you were in benghazi instead of those great people chronic liar and power hungry animal ,0
2184,Hillary Clinton, yaaas hillary wins best dressed here at the merrimack th of july parade hillaryfor nh ,0
2185,Hillary Clinton, the dukes of hazzard has been on tv for years yet you weren t offended until the told you to be ,0
2186,Hillary Clinton, the spatula seems appropriate given that it can be used to easily flip positions if the heat gets to high ,0
2187,Hillary Clinton, why does the shit barometer always rise when republicans speak usa july ,0
2188,Hillary Clinton, the guy w the benghazi sign has guts loveit no hillary ,0
2189,Hillary Clinton, thanks for the follow may god bless you and your family ,0
2190,Hillary Clinton, compassion the new frontier hillary will go where she s never gone before she ll need a village a committee ,0
2191,Hillary Clinton, since snl ain t that funny anymore please run for president if even just for the hilarious debates between you ,0
2192,Hillary Clinton, i support bernie on account usa needs a new direction but if he loses in primary i ll support hillary clinton sanders ,0
2193,Hillary Clinton, your treatment of the press amb stevens fam and the intel of the american ppl is enough to send you to jail ,0
2194,Hillary Clinton, hilly barry s bloody benghazi bamboozle hillary ice cream flavors wake up america ,0
2195,Hillary Clinton, she s the animal she s also a sellout ppl that vote for her are sellouts no hillary ,0
2196,Hillary Clinton, broke as in dead broke elitist nauseating get behind the rope hateful arrogant z ideologue someone else add z ,0
2197,Hillary Clinton, by that time the guy with benghazi sign will be arrested ,0
2198,Hillary Clinton, the people came to see hear hillary not the press obstructing their view ,0
2199,Hillary Clinton, she would have to have a conscious to be haunted marxism ,0
2200,Hillary Clinton, heaven forbid anyone invade the space of the queen of lies ,0
2201,Hillary Clinton, and abedin s penumbra the muslim brotherhood her connection is incontrovertible huma abedin ,0
2202,Hillary Clinton, leftest hippocratic domecrats won t vote for fine lady michell bachmann but will vote for email scandal benghazi killary ,0
2203,Hillary Clinton, support bernie sanders because he s not a liar potus wake up america ,0
2204,Hillary Clinton, she is as bad or worse possibly than obama and she will continue to break laws as if she is invincible ,0
2205,Hillary Clinton, was that awkwardness or awfulness i think the latter ,0
2206,Hillary Clinton, today s number is that s how many years old jesus was when he learned to ride a bike pretty cool dude uswnt ,0
2207,Hillary Clinton, results matter you may feel less safe but that is ur mental health issues no s on obama s watch ,0
2208,Hillary Clinton, grateful for the chance to tell the world about my love of many flavors of ice cream wake up america ,0
2209,Hillary Clinton, if you cant dazzle them with brilliance baffle them with bullshit hillary clinton ,0
2210,Hillary Clinton, its time to rope off killary delete her off your ballot she is a clone of sodom insane obammad wake up america ,0
2211,Legalization of Abortion, i really don t understand how some people are pro choice a life is a life no matter if it s weeks old or years old ,0
2212,Legalization of Abortion, let s agree that it s not ok to kill a lbs baby in the uterus dnc clinton pro compromise ,0
2213,Legalization of Abortion, i would like to see poll how many abortion doctors have told a woman no an abortion is not required in your case ,0
2214,Legalization of Abortion, democrats are always against personhood or what they perceive to be legislation to recognize personhood always colorado ,0
2215,Legalization of Abortion, if you don t draw the line where i ve arbitrarily drawn it you can t draw it anywhere nonsense ,2
2216,Legalization of Abortion, yoder that lady needs help mental illness is a serious issue ,2
2217,Legalization of Abortion, rt new video i m not seeing it as a human being news ,0
2218,Legalization of Abortion, rt we re all human aren t we every human life is worth the same and worth saving j k rowling ,0
2219,Legalization of Abortion, someone snitched on the mom having sex with and playing naked twister with teens i bet it was her cock blocking ass children ,2
2220,Legalization of Abortion, sb passes sen judiciary cmte this bill is an effort to shame women out of their personal private medical decision to have an ,1
2221,Legalization of Abortion, rt debbie washerman schultz the woman has a voice the doctor has a voice who speaks for the baby i m just askin ,0
2222,Legalization of Abortion, a needed safe medical procedure is available to women unfortunately rw men say they should make women s decisions sad huh ,1
2223,Legalization of Abortion, rt it seems to me clear as daylight that abortion would be a crime ghandi pro life youth ,0
2224,Legalization of Abortion, defunding pp won t mean fewer abortions it will mean more dead women ,1
2225,Legalization of Abortion, govt cannot force you to get chemo but if you re a fetus you must live julie borowski ,1
2226,Legalization of Abortion, a person s a person no matter how small dr suess waar ,0
2227,Legalization of Abortion, as long as they are allowed to show medically correct photos of contraception use at the family planning table stop abortion ,0
2228,Legalization of Abortion, thanks for gently spoken truth how do we as a nation protect the innocent the five ccot dnc rnc ,0
2229,Legalization of Abortion, obama cares more about deserters than unborn babies protect the unprotected anti abortion ,0
2230,Legalization of Abortion, dear nuns your advocacy of tax paying is weird iraq taxpayer pride ,2
2231,Legalization of Abortion, i ve noticed that everybody that is for abortion has already been born ronald reagan letthem live all lives matter ,0
2232,Legalization of Abortion, follow patriot thanks for following back truth liberty justice pro israel wake up america free amir now ,2
2233,Legalization of Abortion, report not sure i agree with her decision but it is her decision i wonder how many of the critics would support abortion ,1
2234,Legalization of Abortion, patient advocate stephen casey of texas center for defense of life strongly supports hb t xlege ,0
2235,Legalization of Abortion, are the same people who are red faced and frothing over abortion also against the death penalty just wondering ,1
2236,Legalization of Abortion, hey megan a baby s heart starts beating at days after conception no time is the right time to end its life ,0
2237,Legalization of Abortion, not so great for the women you want to force to give birth against their wills ,1
2238,Legalization of Abortion, what a great day to argue the benefits of making abortion legal ,1
2239,Legalization of Abortion, if my body is the only way you can live and i don t want that i have the right to dismiss you i don t know why that s a problem ,1
2240,Legalization of Abortion, people who want kids can b prochoice you don t have to want an abortion to b prochoice people who had a miscarriage can b prochoice ,1
2241,Legalization of Abortion, don t you mean to say all children deserve the same chances except the unborn children ,0
2242,Legalization of Abortion, you know what s best for you you know what s best for your happiness you know what s best for your well being ,1
2243,Legalization of Abortion, only if you want me to smash ur head through a solid wall made of steel each time you say it then shore honay ,2
2244,Legalization of Abortion, assaulting manipulating pregnant people doesn t reduce ,1
2245,Legalization of Abortion, people who have never had an abortion can be prochoice people with a uterus can be prochoice people who never want kids can be ,1
2246,Legalization of Abortion, my hat is off to you for speaking out about something that is rarely discussed by anyone who has a voice ,2
2247,Legalization of Abortion, anti vaxxers are such an idiotic bunch seriously guys vaccinate your kids ,2
2248,Legalization of Abortion, they may need to figure out how to get out of school or work that day ,2
2249,Legalization of Abortion, god forbid you d ever have to walk a mile in her shoes then you really might know what it s like to have to choose ,1
2250,Legalization of Abortion, i know what s best for my health you don t know anything about me ,1
2251,Legalization of Abortion, some people are not ready for a child or they were even raped and theres already too many kids who need adopting anyway ,1
2252,Legalization of Abortion, rt passu dear religious right i keep my uterus out of your church so keep your church out my uterus ,1
2253,Legalization of Abortion, dehumanizing why are you dehumanizing the pregnant person they re more than walking incubators and have rights ,1
2254,Legalization of Abortion, the democrats just gave the most chilling reply when asked if they support aborting pound babies ,0
2255,Legalization of Abortion, up at this ridiculous hour to alabama ,2
2256,Legalization of Abortion, tip for protesters everywhere your goal is to change the minds of rational adults not to scar the minds of little kids pgh ,2
2257,Legalization of Abortion, good morning patriots let us continue to pray for this great nation and the un born on this great day god has given us ,0
2258,Legalization of Abortion, children are the greatest blessing which god has bestowed on man and woman pope francis lifeisa gift ,0
2259,Legalization of Abortion, it is the greatest of all mistakes to do nothing because you can only do little do what you can ,2
2260,Legalization of Abortion, good morning do you plan to tell that women on pei deserve the right to choose ,1
2261,Legalization of Abortion, excellent speed dating discussion today in yr class ,2
2262,Legalization of Abortion, ub students for life and are currently on north campus by the student union speaking out against ,0
2263,Legalization of Abortion, sinnfein voted to kill unborn sick children ,0
2264,Legalization of Abortion, how do you plan endorse who d not b able run fed party ,2
2265,Legalization of Abortion, they were slaying their own souls when they offered up their sons when they shed the blood of infants augustine psalm ,0
2266,Legalization of Abortion, bravo to both of you beautifully explained hold up bill ,1
2267,Legalization of Abortion, it s a free country freedom includes freedom of choice ,1
2268,Legalization of Abortion, unthinkable shameful acceptable encouraged desirable the evolution of killing the defenseless ,0
2269,Legalization of Abortion, thank you for another day of life lord christian catholic team jesus ,0
2270,Legalization of Abortion, sent mine two days ago expect it back in two days quick turnaround and great customer service ,2
2271,Legalization of Abortion, both democrats and islamic state murder by dismemberment the only difference is the age of their victims isis ,0
2272,Legalization of Abortion, is a seven pound baby murderer too bad her mom didn t have the same operation baby democrats losers ,0
2273,Legalization of Abortion, wh motherhood s a wage penalty so we pay em to have kids we pay em to kill premature babies wtf s point here libs pjnet ,0
2274,Legalization of Abortion, hillary wants to be a champion for women unless they re unborn ,0
2275,Legalization of Abortion, of course we want the feds to puff puff pass team buck ,2
2276,Legalization of Abortion, like i really need to walk past a bunch of aborted babies to get into the union get out of my peripheral ,0
2277,Legalization of Abortion, follow patriot thanks for following back truth liberty justice pro israel wake up america free amir now ,2
2278,Legalization of Abortion, i think marcus is slightly scared of my radical liberal side ,2
2279,Legalization of Abortion, one day i m gonna set an abortion clinic on fire anyone wanna join ,0
2280,Legalization of Abortion, so ready for my abortion debate ,2
2281,Legalization of Abortion, we have the duty to protect the life of an unborn child ronald reagan ,0
2282,Legalization of Abortion, some bitches be scared to kill a little cockroach in their house but quick to kill a baby ,0
2283,Legalization of Abortion, it s ironic that ppl will perform lifesaving therapies on animals to preserve their lives but have staunch views in favor of ,0
2284,Legalization of Abortion, make their own decisions doesn t mean you need to harass me goodbye now ,2
2285,Legalization of Abortion, is there a gas that increases self mutilation tattoos piercing drugging over eating suicide violence ,2
2286,Legalization of Abortion, took god discipline tobacco out made airtight filled homes w co cuz of energy climate lies evil energy use soared ,2
2287,Legalization of Abortion, deep seated cultural codes religious beliefs and structural biases have to be changed no now what ,2
2288,Legalization of Abortion, plannedparenthood their agenda is all about the money killing babies is big business minority genocide is the result ,0
2289,Legalization of Abortion, rt rt if you re ready to help us defeat assisted suicidelike we defeated abortion expansion pa sny ,0
2290,Legalization of Abortion, yup one of the many reasons i changed parties ,2
2291,Legalization of Abortion, oh look so not only are antichoice strongly against pregnant people s human rights they re also homophobic shocker not ,1
2292,Legalization of Abortion, and do not kill ur children for fear of poverty we provide for them for you indeed their killing is ever a great sin quran ,0
2293,Legalization of Abortion, still waiting for libs to explain how the premeditated murder of a premature baby is reproductive healthcare ,0
2294,Legalization of Abortion, did you know tried to get personhood going via federal ,2
2295,Legalization of Abortion, how ironic is it that im sitting in swiping on right now ,2
2296,Legalization of Abortion, but adoption chooses to let them live obviously a huge difference you can see that right adoption ,0
2297,Legalization of Abortion, cameron i despair i want grandchildren or are they a luxury item catholic ,0
2298,Legalization of Abortion, because it s not your baby body or decision nor does it effect your life in any way so it s none of your business ,1
2299,Legalization of Abortion, obamcare loses again in the supreme court religious freedom win ,2
2300,Legalization of Abortion, the people who never spoke up against the nazis during world war ii were likely live and let live people ,2
2301,Legalization of Abortion, pro choice is pro murder couched in liberal rhetoric ,0
2302,Legalization of Abortion, like ya ll can try and push your views on me anyway but i will remain ,2
2303,Legalization of Abortion, exactly no apologies needed to any of any kind stop apologies for rights ,1
2304,Legalization of Abortion, hillary here s one christian whose religion views will never adapt to include abortion abortion is murder ,0
