,Target,Tweet,Stance
0,Atheism, dear lord thank you for all of ur blessings forgive my sins lord give me strength and energy for this busy day ahead ,0
1,Atheism, blessed are the peacemakers for they shall be called children of god matthew ,0
2,Atheism, i am not conformed to this world i am transformed by the renewing of my mind i speak life god ,0
3,Atheism, salah should be prayed with and allah warns against prayers done just for surah al maoon ,0
4,Atheism, and stay in your houses and do not display yourselves like that of the times of ignorance quran islam ,0
5,Atheism, if we are unsure whether something is halal or haram we should leave it this will our ,0
6,Atheism, papa god i pray that you shower me with more patience ,0
7,Atheism, now that the scoc has ruled canadians have freedom from religion can someone tell harper to dummy his god bless canada ,1
8,Atheism, wow unsubstantiated claims about spooks remember whe i said there were gullible people ,2
9,Atheism, rt that kind of modesty is too arrogant for me christopher hitchens funny ,2
10,Atheism, everyone is able to believe in whatever they want freedom ,1
11,Atheism, the best of you are those who best treat their women and i am the best of people to my women prophet mohammad pbuh ,0
12,Atheism, rt let the righteousness peace and joy of the kingdom be established in my life rom ,0
13,Atheism, stop hold your peace and allow the all powerful god time to fight the battle then you win but god ,0
14,Atheism, faith sees the invisible believes the incredible and receives the impossible god ,0
15,Atheism, prophet muhammad said exchange gift for it will increase your love towards one another quran ,0
16,Atheism, good luck with that ting gwg gfyh ,2
17,Atheism, celebrity atheism is beginning to irk me ,0
18,Atheism, leaving christianity enables you to love the people you once rejected christianity ,1
19,Atheism, clear your thoughts look up to the sky someone there is looking after you god ,0
20,Atheism, heavens and the earth were one connected entity then we separated them and we havemade from water every living thing quran ,0
21,Atheism, could all those who believe in a god please leave the meeting will now continue for the grown ups only ,1
22,Atheism, pop may throw in the towel second half ,2
23,Atheism, the devil is our enemy and our mind is the battleground he plays in josh ricketson rush rushswag ,0
24,Atheism, the odds are already stacked in our favor if we believe in the lord and call him our savior ,0
25,Atheism, when it comes to scientific discoveries the call them bullshit until their texts already knew it ,1
26,Atheism, you can look at others with envy or look to god and focus on what he s calling you to become dream kingdom sized dreams focus ,0
27,Atheism, if the of life is to become wealthy there would be no purpose after becoming wealthy ,0
28,Atheism, if you don t feel the need for god love then you don t desire god ,0
29,Atheism, our cause is making definite marks never stop think ,2
30,Atheism, holy mary mother of god pray for us sinners now and at the hour of our death amen god ,0
31,Atheism, holy mary mother of god pray for us sinners now and at the hour of our death amen god ,0
32,Atheism, what i see in the natural will not stop what god is getting ready to release in the supernatual ,0
33,Atheism, religions stopped being credible the minute the first dinosaur fossil was found ,1
34,Atheism, love those kind of dogs carries baby home from a dump see photo hero ,2
35,Atheism, in the absence of god what are you you are nothing more than an accident or a re arrangement of molecules ,0
36,Atheism, you better go get my ball ,2
37,Atheism, save your people lord and bless those who are yours be their and take care of them forever psalm gnt ,0
38,Atheism, life is the question islam is the answe ,0
39,Atheism, rt thank you lord for such a beautiful sunday truly blessed blessed love happines ,0
40,Atheism, remove the bitterness from my heart lord amen ,0
41,Atheism, sometimes god could be protecting you from something when things don t go the way you want them to trust his will ,0
42,Atheism, faith perseverance and hardwork is what separates dreamers from achievers god first dancer lets work vision work ,0
43,Atheism, my god is comprehensive and not selective ask for thing and get everything love my jesus holycrap thats good news ,0
44,Atheism, his love shows me mercy no matter the darkness that i ve been in ,0
45,Atheism, i ll be answering questions today on reddit r atheism for askan atheist day pm est ama ,1
46,Atheism, it s ask an atheist day have a question ,1
47,Atheism, a has a particular a way of doing things ed welch ,2
48,Atheism, no matter what i face at the end of the day i know i will be okay because i know the maker of the day happy note ,0
49,Atheism, is there a way to get free atheist literature to pass out at an upcoming protest i m planning ,1
50,Atheism, evidence based thought just works out better than superstition based thought ,1
51,Atheism, all these bible studies i ve been a part of at unt makes me kinda wanna to go to seminary school unt gospel ,0
52,Atheism, seizure it s very cool but it s not evidence for any is that what you re implying ,1
53,Atheism, souls are so connected to their creator no matter how hard you tried to disconnect ,0
54,Atheism, and the heaven we created with might and indeed we are its expander quran ,0
55,Atheism, the worst day of my life so far is here setting my nan to rest even as a physicist times like these make you wonder ,2
56,Atheism, if you shout almighty that s just two claims without proof ,1
57,Atheism, where does our morality come from our innate sense of and response to suffering human rights ,1
58,Atheism, no matter what you are going thru i assure you somewhere in the world somebody has it x worse ,2
59,Atheism, dear believers to prove the book you must not read from the book regards an ,1
60,Atheism, for the lord is the spirit and wherever the spirit of the lord is there is freedom corinthians nlt freedom ,0
61,Atheism, true community is being able to disagree and still love one another ,2
62,Atheism, true education and a free mind is the best weapon against any obstacle sahd ,1
63,Atheism, just watched the s cfeatured segment on the life of manny pacquiao if i wasn t on team pacquiao already i would be now ,2
64,Atheism, i look around and find fear i look up with my father and find faith godbetheglory ,0
65,Atheism, you are the strength of my life lord ,0
66,Atheism, it s your plan i just gotta be to work hard seek you ,0
67,Atheism, god never gives us anything we can t handle it s either a victory or a lesson have an amazing day ,0
68,Atheism, you don t run a thing till you run it to the king ,0
69,Atheism, god wouldn t invest his anointing in your life if he wasn t going to bless you gotfaith sayyes ,0
70,Atheism, yeah right laughing out loud wink wink nudge nudge the greatest part is how god s playing along ,1
71,Atheism, god has not given us a spirit of fear and timidity but of power love and self discipline timothy conqueror god ,0
72,Atheism, the sexiest thing you can carry right now is a bible christian ,0
73,Atheism, scientists say that is not from sorry the quran outran you by years s ,0
74,Atheism, english even in death the truth prevails yet what a sorrowful reality ,1
75,Atheism, i will not allow the accuser to accuse me for i am washed and cleansed by the blood of the lamb rev ,0
76,Atheism, india urges its wealthy temples to bolster the economy with ,2
77,Atheism, there s no religion but sex and music sting ,1
78,Atheism, what is more likely to be real bigfoot loch ness monster or god ,1
79,Atheism, alot of angry people in this world peace to all ,2
80,Atheism, want to become in the religion ponder upon the qur it s one of the best means to acquire in the ,0
81,Atheism, rt holy mary mother of god pray for us sinners now and at the hour of our death amen ,0
82,Atheism, true your a fiction is incapable of killing anything ,1
83,Atheism, hooligans can challenge everyone police must do right out of frustration criminals can face their black white ,2
84,Atheism, life is a station not a destination ,0
85,Atheism, i am your cover girl i make up for your lacks and deficiencies i m your very foundation see i blend with you perfectly ,2
86,Atheism, you are quite mistaken ,2
87,Atheism, every time i arrive at my home i m n constant awe of how much my god loves me my family is better than urs i love my life blessed ,0
88,Atheism, i have been crucified with christ i no longer live but christ lives in me galatians holy bible team jesus ,0
89,Atheism, and we created not the heavens and the earth and all that is between them for mere play quran ,0
90,Atheism, it is not the time for posturing pretending or pontificating now is the time for baltimore baltimore riots ,2
91,Atheism, jesus i know you didn t bring me this far to leave me ,0
92,Atheism, i appreciate almighty god for waking me up diz beautiful day giving me brilliant ideas to grow my hustle ,0
93,Atheism, kip laughing as shed my tears bt we all know what s gonna hpn in d end child of god ,0
94,Atheism, i ve been everywhere but still in my spirit today then o thee of lil faith slapped me in my face laughing out loud helives love ,0
95,Atheism, don t allow life to potter you ia misthepotter ,0
96,Atheism, many doctrines have been created so christians could save face ,1
97,Atheism, love for the sahaba is a sign of faith hating the sahaba is a sign of hypocrisy let us respect the sahaba love hypocrisy ,0
98,Atheism, holy mary mother of god pray for us sinners now and at the hour of our death amen ,0
99,Atheism, evidence based thought has its feet planted on the ground superstition based thought does not ,1
100,Atheism, calling all angel the angels will sing for the innocent may god bless you mary jane veloso ,0
101,Atheism, god of the gaps is not evidence ,1
102,Atheism, you can t think by yourself about life and believe in god it just doesn t add up ,1
103,Atheism, there are two kinds of people on earth they who believe in magic miracles myth oh my we who are rational regards an ,1
104,Atheism, the only esteem that won t abandon us is the esteem given to us by jesus scott sauls ,0
105,Atheism, what is the purpose of life why are we here islam is providing clear and concise answers for these questions islam ,0
106,Atheism, know that god is always listening always answering maybe not in ways you had hoped but in ways that he knows are best ,0
107,Atheism, the framers of our constitution meant we were to have freedom of religion not freedom from religion billy graham ,0
108,Atheism, the more afraid you re wrong the stronger you fight to avoid facing facts belief based in fear just compounds that ,1
109,Atheism, years ago today my son was taken from me if there s a god fuck you fuck you very much ,1
110,Atheism, for every tree is known by his own fruit for of thorns men do not gather figs nor of a bramble bush gather they grapes luke ,0
111,Atheism, imagine living a life where you don t get credit for everything you did well but got the blame for everything you did wrong ,2
112,Atheism, guuurl or just alittle cup of you got it ,2
113,Atheism, god cares about everything that concerns you so feel free to talk to him about anything ,0
114,Atheism, necessity is the mother of our deen is complete there is no need for innovation ,0
115,Atheism, my heart and prayers go out to the city of baltimore i can only hope for clarity and resolution for the people of that city ,0
116,Atheism, i bind and rebuke all demons of jihad in the name of jesus ,0
117,Atheism, even if your mind denied god your soul will no ,0
118,Atheism, because made it that way is literally not ever the answer keep curiosity alive ,1
119,Atheism, that nagging doubt you keep having about god gods not testing you it s your intellect trying to tell you your beliefs are bullshit ,1
120,Atheism, lk kjv judge not and ye shall not be judged condemn not and ye shall not be condemned ,0
121,Atheism, this is eternal life that they may know you the only true god and jesus christ whom you have sent john god ,0
122,Atheism, we believe the bible to be the word of god we also believe the book of mormon to be the word of god joseph smith prophet ,0
123,Atheism, do not be discouraged when things dont happen like you planned god has better in store keep pressing forward perserverance ,0
124,Atheism, you scam people out of their money selling words of fear and now claim to have none interesting ,2
125,Atheism, nothing could be more dangerous to the existence of this republic than to introduce religion into politics robert green ingersoll ,1
126,Atheism, the son of god became man so that we might become god athanasius ,0
127,Atheism, i wish i could eliminate culture that is the new ,2
128,Atheism, today s verse he who hears you hears me he who rejects you rejects me jesus luke team cogic bible holy spirit ,0
129,Atheism, if god miraculous and miracles impossible then god impossible rt ,1
130,Atheism, faithful god we that we may learn to trust the uncertainty mystery of walking on water toward you ,0
131,Atheism, let my heart find strength in your presence ,0
132,Atheism, when you ve done everything you can do that s when god will step in and do what you cannot do ,0
133,Atheism, no matter how things look know that god is still in control stay in peace knowing that he will always be with you ,0
134,Atheism, whoever is not kind to the younger ones or does not respect the elders is not from my nation prophet muhammad pbuh ,0
135,Atheism, people may leave you but god will never do ,0
136,Atheism, i stand for human rights thought i care i am an ,2
137,Atheism, i am not a fool who dies in want of wisdom but the words from my mouth feed many prov ,0
138,Atheism, in christ we are righteous and in practice we are being conformed to his image chip ingram quote fb team jesus ,0
139,Atheism, there is power in the name of jesus jesus may the people of north india call upon your name ,0
140,Atheism, rt ask and it will be given to you seek and you will find knock and the door will be opened to you matt ,0
141,Atheism, if hell existed bush would be first in line christian or not morality transcends religion ,1
142,Atheism, i would rather stand with god and be judged by the world than stand with the world and be judged by god godsnotdead truth ,0
143,Atheism, sikhism is not any better either we have to finish all religions st ,1
144,Atheism, i think jesus said it best when he said don t cum in me peter ,1
145,Atheism, if theists had a big mountain of evidence for their god do you think we d ever fucking hear the word faith again ,1
146,Atheism, i don t want the government spying on me i want god doing that ,0
147,Atheism, we re equal to men and this makes us morally superior to them equality for all ,2
148,Atheism, god ensures justice for orphans and widows and god loves the strangers providing them with food and clothing deut ,0
149,Atheism, rt god isn t as interested in what you re doing as he is in who you are becoming bible ,0
150,Atheism, ali al amin lebanon shia it leader from s we rejected iran regime s conduct w ,2
151,Atheism, god can turn around any situation ,0
152,Atheism, ha ha ha ha varun gandhi is great grand son of nehru you love his hindu brahmin ancestry don t you chameleon ,2
153,Atheism, if you regularly base your thoughts on superstitions you might not be able to think well ,1
154,Atheism, i don t trust you performing your science based medicine on children i don t think it s science or why reiterate ,0
155,Atheism, you cannot expect to walk in the supernatural without the one who is supernatural dontdoministryalone boom ,0
156,Atheism, one day i m gonna get this thing right with the right one always optimistic ,2
157,Atheism, zubair ibn awwam accepted islam at the age of and dedicated his to protecting and promoting the blessed ten ,0
158,Atheism, certainly both matthew and john were eyewitnesses liar ,1
159,Atheism, one of my favorite quotes of all time change your thoughts and you change your world norman vincent peale positivity ,2
160,Atheism, there is no such word as impossible if you are walking with the king of glory ,0
161,Atheism, god has a wonderful way of turning negatives into positives ,0
162,Atheism, if you seek nothing but the will of god he will always put you in the right place at the right time ,0
163,Atheism, ze they delight in their abominations isaiah jade helm revelation ,0
164,Atheism, i know that my redeemer lives and that in the end he will stand on the earth god christians christianity ,0
165,Atheism, humanity is deeper than race gender and religion it s love inv ,2
166,Atheism, i adore the women the lord is making me into wow forevergrateful iwasmeanttobeallalong ,0
167,Atheism, struggling with identity is very real christians need to look in christ he has your and tweeters ,0
168,Atheism, as bad as it looks as chaos reeks havoc as dark as the days grow god still and forever will ever be always in control phn ,0
169,Atheism, rt let the scepter of your kingdom be released heb ,0
170,Atheism, rt let the gates of my life and city be opened for the king of glory to come in ps ,0
171,Atheism, let us offer through jesus a continual sacrafice of praise to god proclaiming our allegiance to his name hebrews nlt god ,0
172,Atheism, beware of the prosperity doctrines of greed and vanity greed ,2
173,Atheism, if thinks it s scandalous women make less than men for the same work why are there no women priests catholic vatican ,2
174,Atheism, jesus wants you to love those that persecute you not bring them violence love them as he loves you love peace ,0
175,Atheism, god gave us a mind and he expects christians to use their own don t be led around by the decisions of others truth ,0
176,Atheism, religious people are people too just bigoted genitalia mutilating angry gullible people ,1
177,Atheism, the desire to reach for the stars is ambitious the desire to reach hearts is wise maya angelou ,2
178,Atheism, sweet congratulations to a rational decision ,2
179,Atheism, therefore confess your sins to each other and pray for each other so that you may be healed james ,0
180,Atheism, you have not to be indifferent to those children who are starving in the desert they and you are being connected to each other ,2
181,Atheism, they tried to bury us they didn t know we were mexican proverb tolerance coexistence liberty one world ,2
182,Atheism, rt pray as though everything depended on god work as though everything depended on you love grace ,0
183,Atheism, why criticise religions if a path is not your own don t be pretentious and get down from your throne ,0
184,Atheism, push through any pain you feel today your dreams are worth it power through n odaysoff ,2
185,Atheism, never get so busy making a living that you forget to make a life life ,2
186,Atheism, religious leaders are like political leaders they say what they think people want to hear ,1
187,Atheism, satan is busy but god is in control god spiritual motivation relax no worries strength ,0
188,Atheism, mary most sorrowful mother of christians pray for us catholic ,0
189,Atheism, greater is he who is in you than he who is in the world john ,0
190,Atheism, amber rudd is a joke trying too much to espouse thatcherism greece band aid help our own be a human being ,2
191,Atheism, it s prayer time call in am friday access code pray for charleston usa life line ,0
192,Atheism, rt lord bless my latter end more than my beginning job ,0
193,Atheism, rt pray for orphans in north korea over the years found themselves homeless teamjesustweeters ,0
194,Atheism, rt i command all spirits of addiction to come out of my appetite in the name of jesus ,0
195,Atheism, god because you hold us close give us the courage to let go when we need to ,0
196,Atheism, for the of the for the sighing of the now will i arise psalms bible god ,0
197,Atheism, praying is ignorance there s no god loving is what matters it requires honesty we must conserve h drought ,1
198,Atheism, rt ye are the light of the world a city that is set on an hill cannot be hid matthew shine be light ,0
199,Atheism, thou shall think for ones self ,1
200,Atheism, and it s almost the end ,2
201,Atheism, for no one can lay any foundation other than the one that has been laid that foundation is christ ,0
202,Atheism, if current trend of constitution making continues indigenous peoples would more than madhesis hachhethu ,2
203,Atheism, indigenous would lose more than madhesi if da current trend of constitution making continues hachhethu ,2
204,Atheism, i m looking for a seed who would stand for identity forever hachhethu ,2
205,Atheism, i will dwell in a peaceful habitation in secure dwellings and in quiet resting places isa ,0
206,Atheism, all the you ve given all the ways you ve made the fact that i m still living how dare i wear on my face i ll lyric tweet ,2
207,Atheism, i d rather go to hell then worship some image created by whites ,1
208,Atheism, i bought the world and sold my heart you traded heaven to have me again ,0
209,Atheism, only answer to the israel palestine problem is a with a huge emphasis on ,2
210,Atheism, therefore iwilllook unto thelord iwill wait for the god of my salvation my godwillhear me micah ,0
211,Atheism, rt faithfulness actually means full of faith beyond service and commitment your heart shld be full of faith rw atl ,0
212,Atheism, i bind and cast out every spirit of the desert owl fox dragon hyena and vulture in the name of jesus isa ,0
213,Atheism, countless more will die until this race will die by self inflicted genocide ,2
214,Atheism, rt humanist love to everyone at aeu assembly celebrating th anniversary amazing ,2
215,Atheism, what happened to this world attacks in france tunisia and kuwait kill dozens is this what you do in ramadan ,2
216,Atheism, i have never been more dismayed for the future of america than today we have forgotten why we re here to begin with ,2
217,Atheism, it s been a really really bad week for bigots lgbt equality nondiscrimination ,2
218,Atheism, the far right wing is imploding and they can t understand why too funny scotus marriage ,2
219,Atheism, small steps eradicating bigotry remove confederate flags healthcare for all legalize gay marriage ,2
220,Atheism, i don t know which i m more surprised by the usa or ireland for their action on gay rights usa ireland ,2
221,Atheism, the world was made a better place today even if it was on a small scale it was a small step forward ,2
222,Atheism, in other news this week foxnews lost half its viewers due to heart attacks well at least they have obamacare unite b iue ,2
223,Atheism, on a terrible day elsewhere president obama s beautiful inspiring words on gay marriage are so welcome ,2
224,Atheism, imagine no religion there s no god loving one another unconditionally is what matters way to go usa love wins ,1
225,Atheism, news alert from heaven in an effort to minimize the workload god decides to only answer ,0
226,Atheism, our country is finally moving beyond outdated religious definitions of marriage ,1
227,Atheism, now let s get scotus to rule that under god on the currency violates the establishment clause ,1
228,Atheism, our country always had legal acts that ve been illegal according to god s law keep your eyes service on the only real judge ,0
229,Atheism, idc what the bible says constitution says you can take it and shove it right back where it came from we aren t a theocracy ,1
230,Atheism, today is the day we finally join other free nations in celebrating equality for all long overdue love wins ,2
231,Atheism, a win for health care a win for love it s been a good two days ,2
232,Atheism, when r you going to get some balls stand up against the insanity of god worship fuck religion fuck jesus ,1
233,Atheism, when r you going to stand up against the stupidity of faith belief w o evidence fuck religion fuck jesus ,1
234,Atheism, a defining moment for the u s yes but even more so for the human species we continue to march forward proud to love love wins ,2
235,Atheism, fruity pebbles might just be the perfect breakfast today love wins love is love scotus marriage love never fails pride ,2
236,Atheism, a big muah to everyone in america love wins marriage equality ,2
237,Atheism, i m so proud of the u s let s keep the momentum going and make more progress for all love wins ,2
238,Atheism, do nothing for god do everything for humans love wins ,1
239,Atheism, we all end to come out diversity be who you are ,2
240,Atheism, today makes me really happy because we are one step closer to full equality in america ,2
241,Atheism, i know why he has to do it given the audience and the events but the god talk in president obama s speech jars with me a lot ,1
242,Atheism, i am strong because i am wise and full of knowledge prov ,0
243,Atheism, graveyards owned by the local authority are available to people of all religions or none ,2
244,Atheism, yeah well he wasn t a fan of gay marriage a few years ago so let s just see how this goes ok ,2
245,Atheism, defend me from those who rise up against me ps ,0
246,Atheism, atheism involves what a person does or does not believe agnosticism involves what a person does or does not know waterford ,2
247,Atheism, one don t have to kill the old ones for a newly born life humanity ,2
248,Atheism, read article of the tripoli treaty in which pres john adams makes clear america is not a christian nation ,1
249,Atheism, bodd i can see why it s deleted laughing out loud love wins ,1
250,Atheism, just because the supreme court grants something doesn t make anything equal equality like anything else is matter of the heart ,2
251,Atheism, today i am glad to have one more reason to be proud of the country i live in lgbt scotus ,2
252,Atheism, or maybe random shit happens to everyone regardless of whether or not they have a make believe friend ,1
