,Target,Tweet,Stance
718,Climate Change is a Real Concern, equity and is what needs says fabius at un ga ,2
719,Climate Change is a Real Concern, can we build lftr now before its degrees during summer my ac sucks ,1
720,Climate Change is a Real Concern, what is at stake is the survival of our and next generation indigenous people youth unga action cop ,1
721,Climate Change is a Real Concern, stress on resources threatens lives and livelihoods ,1
722,Climate Change is a Real Concern, minister about the importance of ind cs to build momentum to paris at press conference at un ,2
723,Climate Change is a Real Concern, why is the pope upset via unzipped truth pope francis ,2
724,Climate Change is a Real Concern, the eu is spending the billion collected through environmental tax on fossil fuel subsidies almedalen ,1
725,Climate Change is a Real Concern, these days this i i it years ago simply walked away but i know regards dion democracy goal ,2
726,Climate Change is a Real Concern, scotus we need to force to cut of and other pollutants as soon as possible potus epa justices ,1
727,Climate Change is a Real Concern, the ruling by is a major setback for the environment ,1
728,Climate Change is a Real Concern, time to change the government c ,1
729,Climate Change is a Real Concern, sebamm seb prtner explains the work of the ipcc ,2
730,Climate Change is a Real Concern, great news to arrest a regulatory agency s flagrant over reach pathetic how little epa knows of ,1
731,Climate Change is a Real Concern, i can literally sense the global warming now ,1
732,Climate Change is a Real Concern, weather patterns evolving very differently over the last few years ,1
733,Climate Change is a Real Concern, coldest and wettest summer in memory ,1
734,Climate Change is a Real Concern, pope francis really makin the rounds pope francis ,2
735,Climate Change is a Real Concern, shit who set the supreme court to evil again ,2
736,Climate Change is a Real Concern, ballot paper posted has my vote for leader our liberal voice will be heard human rights act affordable housing ,2
737,Climate Change is a Real Concern, i am thinking of turning the central heating off ,2
738,Climate Change is a Real Concern, if like me you felt voiceless then listen to fighting for the human rights act affordable housing ,2
739,Climate Change is a Real Concern, being an engaged mom means voting the climate supporting only candidates who have a plan act on ,1
740,Climate Change is a Real Concern, we could do something the question is will we says ,1
741,Climate Change is a Real Concern, so its degrees celcius in mendoza argentina beginning of winter ,1
742,Climate Change is a Real Concern, it doesn t simply rain in houston anymore it storms ,1
743,Climate Change is a Real Concern, i don t care why the globe is warming i just want to stop it before there is irreparable harm ,1
744,Climate Change is a Real Concern, world futures council man at points out absurdity of cost benefit analysis discounting future lives ,1
745,Climate Change is a Real Concern, last thursday lake mead the largest u s reservoir had the lowest water level reported since history in the making ,1
746,Climate Change is a Real Concern, here we see how environmental deterioration and human ethical degradation are closely linked laudato si ,1
747,Climate Change is a Real Concern, mission climate home defrost old fridges and freezers regularly tip love our planet ,1
748,Climate Change is a Real Concern, obamacare doctors should warn global warmin cud make patients health worse obama president obama white house ,1
749,Climate Change is a Real Concern, china i had plans to work on other things today rude eu china ,2
750,Climate Change is a Real Concern, went for a run now i can t feel my legs and my brain feels like it s boiling ,2
751,Climate Change is a Real Concern, disappointed that we are basing decisions about our very real planet on a man made currency system scotus epa ,1
752,Climate Change is a Real Concern, ask robert redford beyond the national level what can be done on the individual level to mitigate the effects of ,1
753,Climate Change is a Real Concern, canada alone needs invest billion a year paid for by efficiency ,1
754,Climate Change is a Real Concern, cop can succeed or fail if humankind wants to survive something must be done not for nature but for humans simple ,1
755,Climate Change is a Real Concern, robertredford pope say time is now greennh is ready to roll we all want machines what is holdup ,1
756,Climate Change is a Real Concern, sir david attenborough and dissgussing the planet future the room doesn t get any better than this ,1
757,Climate Change is a Real Concern, we should worry about the state he s going to leave australia in nbn fraudband ,2
758,Climate Change is a Real Concern, need to separate natural disasters from man made disasters emphasise polluter pays and need for loss and damage tuvalu pm ,1
759,Climate Change is a Real Concern, at the un with crew now ,2
760,Climate Change is a Real Concern, those items need to come back ,2
761,Climate Change is a Real Concern, rosalind peterson addressing un on how aerosol spraying chemtrails is affecting agriculture not a debate geoengineering ,1
762,Climate Change is a Real Concern, ok yeah that s bad but vancouver literally never used to get this hot ,1
763,Climate Change is a Real Concern, feeling like scotus got it right right right then very wrong sigh climatedenial ,1
764,Climate Change is a Real Concern, northwest heat wave continues first time ever my tomato plants have fruit in june oregon organic ,1
765,Climate Change is a Real Concern, good news scotus confirmed the un has zero authority of u s property or enforcement who cares what the elites say cop ,2
766,Climate Change is a Real Concern, what are the chances kyoto cpc ,2
767,Climate Change is a Real Concern, i think we found something more dangerous to america than ,2
768,Climate Change is a Real Concern, every human commits original sin with it s first outbreath of co mankind is fallen ,1
769,Climate Change is a Real Concern, if you do not repent your emission of co you will end up in hell ,1
770,Climate Change is a Real Concern, and onan cast his co into the atmosphere and committed the sin of emission ,1
771,Climate Change is a Real Concern, as the world emitted co water vapour built up in the atmosphere and caused the lord to send the flood in retribution ,1
772,Climate Change is a Real Concern, mission climate home pass your magazines on to a friend hospital library or nursing home by tip ,1
773,Climate Change is a Real Concern, report says we need ambitious programme like marshall plan or apollo mission to tackle climate change ,1
774,Climate Change is a Real Concern, he is psychic huh ,2
775,Climate Change is a Real Concern, it s nights like this when i m not so fond of my long hair i just wanna chop it all off ,2
776,Climate Change is a Real Concern, we aren t the dinosaurs we re the asteroid ,1
777,Climate Change is a Real Concern, mission climate on the road drive less by tip impact is real ,1
778,Climate Change is a Real Concern, look out for the hashtag uk climate for news today on how the uk is doing in both reducing emissions and adapting to ,1
779,Climate Change is a Real Concern, pupils in p from lincluden primary are participating in carbon busters project learning for sustainability ,1
780,Climate Change is a Real Concern, around new homes being built every year in england in areas at high risk of adding to risk from uk climate ,1
781,Climate Change is a Real Concern, top down approach is not only the solution global governments must act together with global community against ,1
782,Climate Change is a Real Concern, australia your turn to watch obama attenborough ,2
783,Climate Change is a Real Concern, tony abbott hope you re watching president obama talking about ,2
784,Climate Change is a Real Concern, how did the great barrier reef look to you compared to when you dived it years ago attenborough ,1
785,Climate Change is a Real Concern, it s mindblowing to me to watch this sir david attenborough ,2
786,Climate Change is a Real Concern, david attenborough being interviewed by president obama is brilliant fascinating viewing foreign correspondent abc ,2
787,Climate Change is a Real Concern, mission climate home simplify by tip do your part ,1
788,Climate Change is a Real Concern, clean technology this is your moment ,1
789,Climate Change is a Real Concern, d states the media needs to promote the damage of climate change how bout you bolt foreign correspondent ,1
790,Climate Change is a Real Concern, water temperature off the atlantic coast is in the s in june we are like proverbial frogs in boiling water ,1
791,Climate Change is a Real Concern, the met david attenborough change seems possible attainable listen up attenborobama ,1
792,Climate Change is a Real Concern, obama attenborough brilliant heart felt honest why can t we have such a discussion here in oz ,1
793,Climate Change is a Real Concern, scary stat of the day of the area of urban greenspace in england has been lost since ,1
794,Climate Change is a Real Concern, what can young people do about climate change earth sa ,1
795,Climate Change is a Real Concern, gutted i ve missed this would have loved to hear this talk africa represented ,2
796,Climate Change is a Real Concern, everywhere we look moderate weather seems to be going extinct un ,1
797,Climate Change is a Real Concern, feel i ll bin this one upload a newer mix in a few days see which version you like better re s d ,2
798,Climate Change is a Real Concern, yes but silica dust emissions are up and little is done about it at the state level and it effects ,1
799,Climate Change is a Real Concern, tolerance i wonder how much more mother earth has at levels re our ,1
800,Climate Change is a Real Concern, green climate fund projects must be long lasting lay the groundwork for low carbon development economic models ,1
801,Climate Change is a Real Concern, engineering innovation future green tech to deal with ,1
802,Climate Change is a Real Concern, i m sick of celebrities who think being a well known actor makes them an authority on anything else un ,0
803,Climate Change is a Real Concern, man cannot change the climate of any country he adds no new element to the soil charles darwin ,0
804,Climate Change is a Real Concern, redscarebot simple malarkey rt gingerdr global warming climate change all a hoax communist agenda for control ,0
805,Climate Change is a Real Concern, artic ice highest in years for the month of june yet no headlines ,0
806,Climate Change is a Real Concern, there has never been a better time to get the heck out of california ,2
807,Climate Change is a Real Concern, noted climatologist marine biologist oceanographer ted danson told us yrs ago that the oceans would be dead in yrs ,0
808,Climate Change is a Real Concern, i bet as a species man farts more today due to soda carbonated beverages fast food than any other recorded era before ,2
809,Climate Change is a Real Concern, as a general rule mandatory things of all kinds should be refused ,2
810,Climate Change is a Real Concern, excellent speech well done showed ur video to birdie she is ready to be part of the change ,2
811,Climate Change is a Real Concern, the real question is do you feel safe driving a prius through harrison ,2
812,Climate Change is a Real Concern, transpregnancy is a major reason why scientists can t find a cure to ,2
813,Climate Change is a Real Concern, if this heat is killing me i don t wanna know what the poor polar bears are going through right now ,1
814,Climate Change is a Real Concern, when the well is dry we know the value of water ben franklin act on climate epa ,1
815,Climate Change is a Real Concern, yo if you live in the united states right now and do not believe in global climate change you re a fucking idiot ,1
816,Climate Change is a Real Concern, thanks marc levine ilike mike for supporting legislation on ,2
817,Climate Change is a Real Concern, in sind rajasthan temperature incresng in frozen areas rain shower reduced a massive climate change ,1
818,Climate Change is a Real Concern, it s so unfortunate that the systematic destruction of our planet is merely seen to some as a political issue ,1
819,Climate Change is a Real Concern, people at the bar bitching about the heat and drought no one utters the words caused ,1
820,Climate Change is a Real Concern, let me guess you re a lying rabid leftist warmist used to twisting facts to further your agenda ,2
821,Climate Change is a Real Concern, the french you mean the nation that builds tanks with a rear view mirror and six gears in reverse ,2
822,Climate Change is a Real Concern, my dogs are to the beat of my music ,2
823,Climate Change is a Real Concern, a high emissions scenario would be a disaster for marine life as well as for ourselves dr williamson ,1
824,Climate Change is a Real Concern, there are a lot of things that need to be done but first should be changing our mindset water management ,1
825,Climate Change is a Real Concern, it s hot af in this is not normal af ,1
826,Climate Change is a Real Concern, funny how you all of a sudden refer to him as a weatherman now ,1
827,Climate Change is a Real Concern, not to worry sediment cores prove shellfish coral will recover in just years ,1
828,Climate Change is a Real Concern, have never been so outrageously grateful for a slight cool breeze drifting over my body is this the future ,1
829,Climate Change is a Real Concern, hey please reject the adani carmichael mine and abbot point our reef and climate are at risk gbr ,1
830,Climate Change is a Real Concern, tornado warnings for the uk this weekend and the government still chooses to ignore global warming ,1
831,Climate Change is a Real Concern, mainau declaration watch out guys this is huge lindau nobel ,2
832,Climate Change is a Real Concern, mainau declaration push the agenga worldwide without any fear ,1
833,Climate Change is a Real Concern, mainau declaration years later lino laureates and young scientists say it is time to act ,1
834,Climate Change is a Real Concern, well designed tax policies can help fix a number of environmental issues it dconf cop ,1
835,Climate Change is a Real Concern, just read scalia s idiotic opinion overturning the epa s carbon emissions limits planning to spend day in a seething rage ,1
836,Climate Change is a Real Concern, don t act as if we have another planet to live in cop ,1
837,Climate Change is a Real Concern, gop clown car a shame considers hrc emails more disconcerting than ,2
838,Climate Change is a Real Concern, poisoning of the biosphere cannot be dealt with by free market economics tax wall street environment gmo ,1
839,Climate Change is a Real Concern, i see this pick up on the rwy with the follow me andr sign it should be the other way round ,2
840,Climate Change is a Real Concern, everyone is busy building their bank accounts but one day that paper won t help you during massive natural calamities ,1
841,Climate Change is a Real Concern, u s should hold referendum prior to paris talks to gauge american support for dealing hopefully leading on ,2
842,Climate Change is a Real Concern, audio world look out there s a new sheriff in town ,2
843,Climate Change is a Real Concern, second heatwave hits na nw popping up everywhere and floods too record wildfires in canada what a mess time up ,1
844,Climate Change is a Real Concern, global warming global warming global warming oh wait it s summer ,0
845,Climate Change is a Real Concern, glblwarmingnews and the tooth fairy might be causing kids to lose teeth chemtrails ,0
846,Climate Change is a Real Concern, tsgtalexander glblwarmingnews and the tooth fairy might be causing kids to lose teeth chemtrails ,0
847,Climate Change is a Real Concern, brettgarrot brettgarrot glblwarmingnews and the tooth fairy might be causing kids to lose teeth chemtrails ,0
848,Climate Change is a Real Concern, when did co become a dangerous pollutant that must be curtailed what do you exhale again iwantanswers ,0
849,Climate Change is a Real Concern, we re growing vegetables at home tell your friends and followers what you re doing for climate change for climate ,1
850,Climate Change is a Real Concern, led lights water saving toilets showerheads appliances etc when we renovate we choose efficient change for climate ,1
851,Climate Change is a Real Concern, evening any thoughts as yet i get easy re the of it all hop hop regards d gms ,2
852,Climate Change is a Real Concern, if ther clmate change alarmists come out in sept this year and tell me this was the hottest winter on record ill go postal ,0
853,Climate Change is a Real Concern, wonderful to find you on twitter meet a canadian working in ,2
854,Climate Change is a Real Concern, before we can defeat isis we first must defeat ,2
855,Climate Change is a Real Concern, mission climate home reduce reuse recycle replenish restore by tip earth right now ,1
856,Climate Change is a Real Concern, without a place for feeding mating and giving birth there is no future for polar bears ,1
857,Climate Change is a Real Concern, bc continues to burn if this ain t a wake up call to everyone then nothing will be vancouver ,1
858,Climate Change is a Real Concern, pittsburgh had a regatta without boats river full of debris and swift currents too dangerous ,2
859,Climate Change is a Real Concern, un decline of in crop yields in developing countries rice wheat corn over the next years especially in the tropics ,1
860,Climate Change is a Real Concern, great meeting and today to discuss future cities and how uk expertise can be shared applied in china ,2
861,Climate Change is a Real Concern, my priority is to address ,2
862,Climate Change is a Real Concern, rt one of the most brilliant bs stories created by man to subjugate others leftist lies is bs ,2
863,Climate Change is a Real Concern, there is need for world economic powers to be true about climate change funding the world needs action not empty rhetorics ,1
864,Climate Change is a Real Concern, cops un conferences board room meetings till when shall this continue when innocent lives and livelihoods are lost ,2
865,Climate Change is a Real Concern, scorching summers for uk by end of the century thank rocks i won t be here to suffer them ,1
866,Climate Change is a Real Concern, try to create the world you want to live in with compassion ,2
867,Climate Change is a Real Concern, sea level rise by the end of the century meters will drown sf airport and la port with compassion ,1
868,Climate Change is a Real Concern, climate change is an emergency stop denial and start taking steps ,1
869,Climate Change is a Real Concern, rt when the rate of utilisation exceeds the rate of regeneration then it calls for degradation ,2
870,Climate Change is a Real Concern, climate change is a solvable problem but we need to start today hhdl ,1
871,Climate Change is a Real Concern, suggests we should have schools for politicians to educate them on critical issues with compassion hhdl ,2
872,Climate Change is a Real Concern, i m guessing there was a lot less humidity back in the time of moses ,1
873,Climate Change is a Real Concern, are these ominous yellow vancouver skies making anyone else dread our climate future ,1
874,Climate Change is a Real Concern, cause and effect dry conditions wildfires preventable human caused ,1
875,Climate Change is a Real Concern, saving my tomorrow why are you guys not promoting this like crazy hbo ,2
876,Climate Change is a Real Concern, greenland s ice is melting faster this summer under a dome of high pressure ,1
877,Climate Change is a Real Concern, installing new forest fire navigation systems no kinder morgan no tar sands ,2
878,Climate Change is a Real Concern, it s crazy oklahoma is bracing for more flooding rains th cycle this year canada is burning ,1
879,Climate Change is a Real Concern, that awkward moment when a pro coal pr campaign has over k more followers than you do ,1
880,Climate Change is a Real Concern, i m gonna side with the really smart and well educated folks on this one guys ,2
881,Climate Change is a Real Concern, climate change financing cc adaptation cc and resilience the green economy lots of semantics as communities waitforsolutions ,1
882,Climate Change is a Real Concern, usa is behind due to idiocy ,2
883,Climate Change is a Real Concern, tonight academy of science talk tech solutions for climate change with prof barry brook canberra ,1
884,Climate Change is a Real Concern, the snow is melting tcot ,2
885,Climate Change is a Real Concern, images like this make me fearful that the next epidemic must be coming soon ,2
886,Climate Change is a Real Concern, you re proud of that shoal lake fort chip vanuatu bala falls ,2
887,Climate Change is a Real Concern, the mn twins game is going really fast tonight more proof of ,2
888,Climate Change is a Real Concern, kck further proof of ,2
889,Climate Change is a Real Concern, please don t let him win this your loyal readers support you ,2
890,Climate Change is a Real Concern, wish everyone wasn t so pale this season the bachelorette ,2
891,Climate Change is a Real Concern, national announces plan to put out fire in pantry rest of the house can burn baby burn ,2
892,Climate Change is a Real Concern, rent a theatre and show the movie chasing ice to my friends and family to spread the message of global warming my ,1
893,Climate Change is a Real Concern, rt easyprintitja rt firstkingtre freak in kingston jamaica sudden ,2
894,Climate Change is a Real Concern, stormiest in ireland and uk in years that saying something ,1
895,Climate Change is a Real Concern, wrong re the ipc creport the involved i do have to say regards dion ,2
896,Climate Change is a Real Concern, take down the flag love wins represent tectonic cultural shifts thanks in no small part twitter facebook imagine same ,2
897,Climate Change is a Real Concern, i expected new zealand s so called leaders to show leadership instead they show weak minded ignorance laggardship ,2
898,Climate Change is a Real Concern, reduction is this a joke our govt seems to be more concerned about flag change than ,2
899,Climate Change is a Real Concern, until newyork london frankfurt knee deep in sea nothing will happen free parties ,1
900,Climate Change is a Real Concern, the climate science forum begins today follow its progress on cfcc sustainable development ,1
901,Climate Change is a Real Concern, we need integrated with knowledge to understand adapt to cfcc ,1
902,Climate Change is a Real Concern, while this debate goes on yet more time is wasted ,2
903,Climate Change is a Real Concern, if sea levels get any higher flooding in lowlands could become dire ,1
904,Climate Change is a Real Concern, if we don t do anything we will be the sad generation that had the opportunity to act and didn t cfcc journey ,1
905,Climate Change is a Real Concern, vallaud belkacem are we the generation who knew what would happen but who did nothing say no cfcc ,1
906,Climate Change is a Real Concern, if we do not act we will be the generation who knew but did not move cfcc ,1
907,Climate Change is a Real Concern, the carbon clock is ticking surplus gas ,1
908,Feminist Movement, always a delight to see chest drumming alpha males hiss and scuttle backwards up the wall when a feminist enters the room ,1
909,Feminist Movement, sometimes i overheat and want to take off my shirt but can t because of social expectations of people with breasts n ,1
910,Feminist Movement, if feminists spent as much time reading papers as they do tumblr they would be real people not ignorant sexist bigots ,0
911,Feminist Movement, stupid feminists the civilization you take for granted was built with the labour blood sweat and tears of men ,0
912,Feminist Movement, you re a girl and have a sex drive you must be a slut ,1
913,Feminist Movement, suns out dresses out street harassment out this shouldn t be daily life yes all women ,1
914,Feminist Movement, women s rights are join the cp dvoices twitter rally at pm et if you agree cpd ,1
915,Feminist Movement, so you support unequal pricing based on gender don t you normally call that sexism equal pay day ,1
916,Feminist Movement, these pics of with without makeup just perpetuating the myth that women need makeup to be considered pretty ,1
917,Feminist Movement, yes all women should know how to protect herself which is why i carry a gun ,1
918,Feminist Movement, links in sauga gotta stop chincing girls and taking away that extra bit ,1
919,Feminist Movement, rt i support whatever team buck supports ,2
920,Feminist Movement, tired of anti womanist respectability politics we need a safe space for women can look like they re at the club at an interview ,1
921,Feminist Movement, if you re a feminist and you hate men please kill yourself ,0
922,Feminist Movement, women don t make less than men for the same job women on average make less then men look it up feminazis equal pay day ,0
923,Feminist Movement, you need feminism more than you need anything else in your life you couldn t survive or speak w o it ,1
924,Feminist Movement, mras just tried to enlighten me which went about as well as the flight of the hindenburg ,1
925,Feminist Movement, why do girls women spend so much time to be pretty and attractive and then complain if they re reduced to a sex symbol ,0
926,Feminist Movement, i hate to break it to you bruh but women do get pretty for us they get pretty to show other women ,1
927,Feminist Movement, job should always go to best candidate regardless of gender gender shouldn t even matter anymore it s paul henry ,1
928,Feminist Movement, what do you say to a woman with two black eyes nothing she s already been told twice ,0
929,Feminist Movement, did you know gender stereotypes as we know then developed with beginning of the century ,1
